submit_data,food_type,description,amount,rating,comments,risk_factor,food_photo,location_name,location_photo,gps,_gps_latitude,_gps_longitude,_gps_altitude,_gps_precision,imei,submit_date,_uuid,_submission_time
12/30/2011,street_meat,Turkish burger ,2,delectible,n/a,low_risk,n/a,n/a,n/a,41.01452808827162 28.97566007450223 57.4000244140625 30.0,41.01452809,28.97566007,57.40002441,30,3.5849E+14,12/30/2011,030e20a618f74ac1ad597b35883f4314,2011-12-30T08:44:00
12/30/2011,drunk_food,Shisha! ,20,delectible,Should have brought a board game! ,low_risk,1325234084489.jpg,Kosebasi Nargile ,1325234137252.jpg,n/a,n/a,n/a,n/a,n/a,3.5849E+14,12/30/2011,1f41b91b1d8748cfa60b7361620c7a58,2012-01-01T14:10:14
12/30/2011,streat_sweets,Fistikli,2,delectible,Great staff,low_risk,1325233793480.jpg,Tatlic Safa,1460139580042.jpg,41.016706293448806 28.970129443332553 44.9000244140625 40.0,41.01670629,28.97012944,44.90002441,40,3.5849E+14,12/30/2011,3f2f315ba01947e8bd918399cf5408b1,2011-12-30T09:53:56
12/30/2011,streat_sweets,Turkish donuts,2,delectible,Pure oil and honey,low_risk,1325233641666.jpg,Tahiri Osmanli Lokmaci,1325233694501.jpg,41.0182375414297 28.97094827145338 39.0 30.0,41.01823754,28.97094827,39,30,3.5849E+14,12/30/2011,41260d9d9b1944ce8aa91c9e7427a891,2011-12-30T08:19:48
12/30/2011,deserts,Baklava,2.75,epic_eat,Some of the best ever,low_risk,1325233872157.jpg,Karakoy Gulluoglu,1325233903109.jpg,41.02281326428056 28.977699307724833 39.9000244140625 40.0,41.02281326,28.97769931,39.90002441,40,3.5849E+14,12/30/2011,f8282787848c41258aa22f53dc07aff8,2011-12-30T08:35:45
1/5/2012,caffeination,Turkish coffee,2.5,epic_eat,n/a,low_risk,1325755277925.jpg,n/a,1325755322963.jpg,37.95044002588838 27.37236267887056 55.70001220703125 20.0,37.95044003,27.37236268,55.70001221,20,3.5849E+14,1/5/2012,0cce5f448df1484c8bfe25b91d6b25b9,2012-01-05T10:44:16
1/3/2012,lunch,Tander Doner,18,epic_eat,n/a,low_risk,1325593910357.jpg,Ustabasi ,1325593932637.jpg,38.420649245381355 27.136479495093226 56.9000244140625 35.0,38.42064925,27.1364795,56.90002441,35,3.5849E+14,1/3/2012,34da20f7a02447ddb430a88802714c97,2012-01-05T10:35:49
1/4/2012,lunch,Cotsi ,8,delectible,n/a,low_risk,1325672462974.jpg,Tolga Copsis ,1325672494341.jpg,37.951282449999994 27.3700048 0.0 85.0,37.95128245,27.3700048,0,85,3.5849E+14,1/4/2012,68ed8fb48c1243a5b60525987f18f3de,2012-01-05T10:39:09
1/15/2012,lunch,Portuguese Chicken,20,delectible,Get the fries over potatoes ,low_risk,1326658785039.jpg,Frango,1326658821173.jpg,45.527838800000005 -73.57514007142858 0.0 60.0,45.5278388,-73.57514007,0,60,3.5849E+14,1/15/2012,879e6d9e203f497696986ad061a5c18e,2012-01-15T15:47:56
1/28/2012,dinner,Sushi ,1600,epic_eat,Freaking awesome ,low_risk,1327772438992.jpg,Furusato,n/a,-1.2705402 36.8167218 0.0 75.0,-1.2705402,36.8167218,0,75,3.5849E+14,1/28/2012,281411919409465b92f0d00adc1704d0,2012-01-28T12:42:36
1/27/2012,lunch,Beef stew and ugali ,200,delectible,Better with Pili Pili ,low_risk,1327658854849.jpg,KP's,n/a,-1.2834895 36.81660155 0.0 61.0,-1.2834895,36.81660155,0,61,3.5849E+14,1/27/2012,22200a65d83f4ef9986c2b34136ab769,2012-01-28T07:28:58
4/24/2013,n/a,n/a,n/a,n/a,n/a,n/a,n/a,P,n/a,n/a,n/a,n/a,n/a,n/a,8.6358E+14,4/24/2013,84d6fc1740534b03b5a0d8b12a9b7a27,2013-04-24T01:10:50
4/7/2012,lunch,Bang mi sandwich ,4.25,epic_eat,n/a,low_risk,1333825651002.jpg,Saigon bakery ,n/a,40.71915229316801 -73.99702923372388 -9.899993896484375 10.0,40.71915229,-73.99702923,-9.899993896,10,3.5849E+14,4/7/2012,3e568d9d4f0e47aa821cb81553128cca,2012-04-26T05:39:36
3/25/2012,morning_food,Pizza Biongiornio ,12,delectible,n/a,low_risk,1332692558248.jpg,n/a,n/a,49.26994343 -123.15297940999999 0.0 56.0,49.26994343,-123.1529794,0,56,3.5849E+14,3/25/2012,74896779767b4fa38de3cb3ed399a039,2012-04-26T05:38:43
4/19/2012,morning_food,Idli radda ,28,epic_eat,n/a,medium_risk,1334808099018.jpg,Addigas ,1334809255176.jpg,12.613462437875569 77.0583969913423 572.5 35.0,12.61346244,77.05839699,572.5,35,3.5849E+14,4/19/2012,7f2ad6f470c24027baa1781bccadead6,2012-04-26T05:40:25
3/19/2013,lunch,Ikan,10000,delectible,Enak segar,low_risk,n/a,Cristo Rei,n/a,n/a,n/a,n/a,n/a,n/a,a1000028adb254,3/19/2013,3ca93cca1bfb4d67ac93f0cfe0b72555,2013-03-19T03:34:20
4/24/2013,n/a,Hjhh,5585,delectible,Jj,low_risk,n/a,n/a,n/a,n/a,n/a,n/a,n/a,n/a,8.6358E+14,4/24/2013,015b76703b874ff99ac899554c7ce6b4,2013-04-24T01:12:22
4/23/2013,dinner,Night market in Kupang,175000,delectible,Ikan and Ayam Baram,high_risk,1366722420256.jpg,Warung Lalapan,n/a,-10.158850969746709 123.58068312518299 52.9000244140625 5.0,-10.15885097,123.5806831,52.90002441,5,3.51746E+14,4/23/2013,2b6f6960985949b888e0ec0be447700e,2013-04-23T19:28:51
4/24/2013,n/a,n/a,n/a,n/a,n/a,n/a,n/a,n/a,n/a,33.6830403 73.0423534 0.0 976.0,33.6830403,73.0423534,0,976,8.6358E+14,4/24/2013,fda1f605949b4f25b04f4cd2893ef292,2013-04-23T23:15:25
4/24/2013,n/a,Oiuy,n/a,n/a,n/a,n/a,n/a,n/a,n/a,33.6830403 73.0423534 0.0 976.0,33.6830403,73.0423534,0,976,8.6358E+14,4/24/2013,d236e76aa70a4b9eaa386ef87f164c82,2013-04-23T23:15:24
4/27/2012,dinner,Lamb burger ,12,epic_eat,Comes with beer and fries ,low_risk,1335569110174.jpg,La Belle Soeur ,n/a,45.527778600000005 -73.5752153 0.0 56.0,45.5277786,-73.5752153,0,56,3.5849E+14,4/27/2012,1736b1b230cc491c9d14a3e2de175e85,2012-04-28T18:40:46
4/27/2012,libations,Pots ,9.5,epic_eat,n/a,low_risk,1335577418842.jpg,Distellery ,n/a,45.527778600000005 -73.5752153 0.0 56.0,45.5277786,-73.5752153,0,56,3.5849E+14,4/27/2012,88afa14cfb314893a662b6b858693bd2,2012-04-28T18:41:26
4/24/2013,n/a,n/a,n/a,n/a,n/a,n/a,n/a,n/a,n/a,33.685801 73.0439533 0.0 39.0,33.685801,73.0439533,0,39,8.6358E+14,4/24/2013,d116175cbac742c7b88e9157420c37eb,2013-04-23T23:15:23
4/28/2012,dinner,Gado Gado (Bali) ,12,delectible,n/a,low_risk,1335664200735.jpg,n/a,1335664243044.jpg,45.527739716666666 -73.57525235 0.0 51.0,45.52773972,-73.57525235,0,51,3.5849E+14,4/28/2012,07d46772ed3f457d9b178e3045ddba0d,2012-04-29T12:40:40
4/22/2013,deserts,thử tiếng việt,12345,epic_eat,ffhj,medium_risk,ryuij,rthj,uii,21.0421 105.7764 0 23,21.0421,105.7764,0,23,no device properties in enketo,4/22/2013,a3af14c8-25e1-4042-8cea-675cddefeb31,2013-04-22T09:38:54
4/22/2013,n/a,fhh,556,n/a,n/a,n/a,n/a,n/a,n/a,21.0421 105.7764 0 24,21.0421,105.7764,0,24,no device properties in enketo,4/22/2013,1823ec6a-adeb-4221-acd9-0f364613648a,2013-04-22T09:45:20
4/10/2013,street_meat,Asdfrio lkjdo,6523,nothing_special,gfrtuhhh bhhh,medium_risk,1365640340440.jpg,dersfg,n/a,7.115910001818679 -73.11778647005579 1004.0 32.0,7.115910002,-73.11778647,1004,32,3.53337E+14,4/10/2013,16531944b3834b959f206e563b4089fd,2013-04-17T21:07:50
5/27/2013,dinner,n/a,6,delectible,n/a,n/a,n/a,n/a,n/a,n/a,n/a,n/a,n/a,n/a,no device properties in enketo,5/27/2013,d7712038-76fb-4817-ac97-af489b5664f4,2013-05-27T03:27:39
3/28/2013,morning_food,n/a,n/a,n/a,n/a,medium_risk,n/a,n/a,n/a,n/a,n/a,n/a,n/a,n/a,no device properties in enketo,3/28/2013,680f60bd-5569-4f3b-b8ab-701378cbe55c,2013-03-27T22:57:54
1/21/2013,street_meat,Test,200,nothing_special,Rest,medium_risk,Test,Pest,Nest,-33.9878 18.4949 0 0,-33.9878,18.4949,0,0,no device properties in enketo,1/21/2013,7b609a31-a9ff-4d2b-8477-59dd00e6ea6d,2013-01-22T07:30:05
2/27/2013,dinner,Nomou iPhone,n/a,epic_eat,n/a,high_risk,n/a,n/a,Bingo!,47.2659 7.8707 0 149000,47.2659,7.8707,0,149000,no device properties in enketo,2/27/2013,f990088a-f47d-44d7-ac00-f8370d936ab3,2013-02-28T06:11:47
1/11/2013,caffeination,Wegj,1236,bad,Wrh,high_risk,1357920730880.jpg,n/a,n/a,n/a,n/a,n/a,n/a,n/a,3.52249E+14,1/11/2013,06f33d39d14b4ba9bb1339fdb5687aef,2013-01-11T11:13:33
12/9/2012,morning_food,Spanish Eggs,890,delectible,Bread basket makes it especially in Kenya ,low_risk,1355046712094.jpg,Art Caffe,n/a,-1.2572642 36.8028136 0.0 47.882,-1.2572642,36.8028136,0,47.882,3.53918E+14,12/9/2012,8813343ff4094fa89d99e1b99af0cd6a,2012-12-26T07:27:27
12/9/2012,street_meat,Delhi kebab,50,bad,"Ugh! 
",high_risk,1355135572721.jpg,WHO,n/a,46.2330235 6.1354609 0.0 30.0,46.2330235,6.1354609,0,30,3.53918E+14,12/9/2012,ea50c52d754341a6836ef287f46e4095,2012-12-10T05:36:50
12/6/2012,morning_food,A nice cup of black tea to start the day off,24,nothing_special,"It's tea, are comments really necessary?",low_risk,n/a,Ethiopia,My table,7.3625 55.0195 0 0,7.3625,55.0195,0,0,no device properties in enketo,12/6/2012,bdf07041-9507-4838-917c-329818b438c6,2012-12-07T03:57:29
3/14/2013,n/a,n/a,n/a,n/a,n/a,n/a,n/a,n/a,n/a,n/a,n/a,n/a,n/a,n/a,no device properties in enketo,3/14/2013,83fb201c-f300-4a5f-bfcd-9d8561a65f81,2013-03-14T02:46:10
4/3/2013,n/a,n/a,n/a,n/a,n/a,n/a,n/a,n/a,n/a,n/a,n/a,n/a,n/a,n/a,3.55661E+14,4/3/2013,344660d05a0e473ba7ad15eb1745c188,2013-07-22T12:22:06
4/4/2013,n/a,Jz,n/a,n/a,n/a,n/a,n/a,n/a,n/a,n/a,n/a,n/a,n/a,n/a,3.55661E+14,4/4/2013,1473f8ff86334535a0b635893a0d3fbc,2013-07-22T11:45:53
12/30/2011,lunch,Chicken doner,9,delectible,Try the yogurt drink,low_risk,1325249519178.jpg,Durum Bufe,1325250480886.jpg,41.017082473263144 28.969059996306896 39.5 55.0,41.01708247,28.96906,39.5,55,3.5849E+14,12/30/2011,218bff1e4ca6480cb76f1f5eba59598b,2011-12-30T08:46:05
1/1/2012,dinner,Testi Kebab Beef,14,delectible,Pottery kebab.  Reminds me of chow mein. ,low_risk,1325447654476.jpg,Kale Terasse ,n/a,38.64260719623417 34.82954294420779 1133.699951171875 15.0,38.6426072,34.82954294,1133.699951,15,3.5849E+14,1/1/2012,73995744688741d4a1d85b9ad7d746df,2012-01-01T14:17:43
12/31/2011,lunch,Manti (Turkish ravioli)  and sautéed mushrooms,12,delectible,n/a,low_risk,1325331368600.jpg,Farmville ,1325331442250.jpg,38.643232850000004 34.8287586 0.0 65.0,38.64323285,34.8287586,0,65,3.5849E+14,12/31/2011,93655d121084457098783d55e23764ce,2012-01-02T22:41:33
1/6/2012,deserts,Rice Pudding ,6,epic_eat,"Maybe best rice pudding ever,  very rich,  best shared. ",low_risk,1325883519633.jpg,Edebiyat Kiraathanesi ,1325883576343.jpg,41.00785487797111 28.976559955626726 98.5999755859375 25.0,41.00785488,28.97655996,98.59997559,25,3.5849E+14,1/6/2012,0a005d5beef54c1cbe9f99c9d8152d4e,2012-01-08T12:01:11
11/30/2012,lunch,Pilau rice with beans,280,epic_eat,n/a,low_risk,1354269384941.jpg,Tamu Tamu,1354269403482.jpg,-1.2641608 36.8040272 0.0 36.0,-1.2641608,36.8040272,0,36,3.53918E+14,11/30/2012,76ed655c65b343df9ed50d1ef4e969cc,2012-11-30T07:38:08
1/1/2013,street_meat,Nyama choma (roasted) goat leg,999,delectible,The flies and cockroaches add a certain piquant taste experience,high_risk,Roasted Goat Leg,"Kenyatta Market, Stall B2, Nairobi, Kenya",n/a,-1.3075 36.7998 0 0,-1.3075,36.7998,0,0,no device properties in enketo,1/1/2013,1a22a24b-44b5-46ea-a5f8-42d1e001e4e6,2013-01-02T11:33:18
11/11/2013,lunch,Blah,666,nothing_special,n/a,medium_risk,n/a,n/a,n/a,-1.2723 36.7756 1775.8 65,-1.2723,36.7756,1775.8,65,no device properties in enketo,11/11/2013,249a5712-a564-4d1d-97ae-46bddb7c21b1,2013-11-11T18:05:54
9/16/2012,dinner,Mongolia stir fries,1200,epic_eat,n/a,low_risk,n/a,Kisumu,BAR,-0.1051 34.7566 0 0,-0.1051,34.7566,0,0,no property preload in Rapaide,9/16/2012,e19982d9f7364f839380e71f12d2ac6f,2012-09-17T10:19:40
1/10/2013,dinner,Tandoori Platter,500,epic_eat,n/a,low_risk,https://lh3.googleusercontent.com/-X7OEKxEAtEQ/UO-wtx3EBtI/AAAAAAAAHnE/Y55TSWl3GKg/s912/IMG_0453.JPG,"Ambience Mall, Gurgaon, India",Rockman's Beer Island,28.502 77.0945 0 0,28.502,77.0945,0,0,no device properties in enketo,1/10/2013,6077a691-f774-4d12-b533-8002cb34526b,2013-01-11T01:32:03
6/27/2013,morning_food,Pão de Queijo,100,bad,Comi com café,low_risk,1372342556496.jpg,DRR,1372342586633.jpg,-15.7885827 -47.8787536 0.0 30.0,-15.7885827,-47.8787536,0,30,3.56891E+14,6/27/2013,89effb60e9ef4c0aadbf5788541d6341,2013-06-27T10:18:33
6/27/2013,dinner,Lasagna ,45,epic_eat,Delicious ,medium_risk,n/a,Buenos Aires ,n/a,-34.60255735 -58.36843526 0.0 290.0,-34.60255735,-58.36843526,0,290,3.56469E+14,6/27/2013,09829adad9034574946a172e77846ba4,2013-06-27T11:01:50
10/17/2013,morning_food,Test,120,nothing_special,Testing hdjdj djdj,low_risk,1381987320677.jpg,Beirut,n/a,33.8695065 35.5181259 0.0 46.815,33.8695065,35.5181259,0,46.815,3.55136E+14,10/17/2013,48af4f9f09d742dc943d64a67991cbe5,2013-10-17T05:23:38
2/27/2013,libations,iPhone,n/a,nothing_special,n/a,low_risk,n/a,n/a,No loc detection...,n/a,n/a,n/a,n/a,n/a,no device properties in enketo,2/27/2013,db13d339-3edd-44db-a072-0c0cc585ec44,2013-02-28T06:03:23
1/10/2013,morning_food,n/a,n/a,n/a,n/a,n/a,https://lh3.googleusercontent.com/-X7OEKxEAtEQ/UO-wtx3EBtI/AAAAAAAAHnE/Y55TSWl3GKg/s912/IMG_0453.JPG,n/a,n/a,n/a,n/a,n/a,n/a,n/a,no device properties in enketo,1/10/2013,d7c43f73-0771-477d-84cc-60aed500470a,2013-01-11T02:57:08
3/21/2013,savory_snacks,Jgzugfi,57,bad,Ugfh,high_risk,1363874426009.jpg,Urtguzr,1363874443881.jpg,46.0784778 14.4960202 0.0 30.0,46.0784778,14.4960202,0,30,3.57116E+14,3/21/2013,4c2a322bf81c41bf9317024d7ba11acc,2013-03-21T10:00:54
2/23/2013,n/a,n/a,n/a,n/a,n/a,n/a,n/a,n/a,test,n/a,n/a,n/a,n/a,n/a,no device properties in enketo,2/23/2013,a7a078f8-25df-43f2-8c8d-22b6df7ca1b5,2013-02-23T22:28:00
2/23/2013,n/a,n/a,n/a,n/a,n/a,n/a,test,n/a,n/a,n/a,n/a,n/a,n/a,n/a,no device properties in enketo,2/23/2013,72d34773-b86d-42cc-ac81-c7aeb311174f,2013-02-23T22:27:52
1/18/2013,morning_food,Bacon butty,2.5,epic_eat,n/a,low_risk,n/a,n/a,n/a,n/a,n/a,n/a,n/a,n/a,3.57649E+14,1/18/2013,d69dd9b0137e441aa35070ab24b539d5,2013-01-18T18:16:29
3/25/2013,morning_food,Mackor,4,nothing_special,n/a,low_risk,n/a,n/a,n/a,n/a,n/a,n/a,n/a,n/a,3.53718E+14,3/25/2013,2a79a1edb6664458b2a817a98d12046b,2013-03-25T08:25:12
2/14/2013,morning_food,n/a,5,delectible,n/a,low_risk,Here,Puebla,Puebla,18.9866 -98.2521 0 0,18.9866,-98.2521,0,0,no device properties in enketo,2/14/2013,6911a9b3-468c-40e2-aa4b-8fd42ff277b0,2013-02-15T00:15:17
2/10/2013,libations,Gggg,56,nothing_special,Ffff,high_risk,1360514347555.jpg,Gggg,n/a,59.40378502 17.78532446 53.400001525878906 5.0,59.40378502,17.78532446,53.40000153,5,3.58835E+14,2/10/2013,a8b4a00a27384c12ba569bfef530a52d,2013-02-10T11:39:50
2/8/2013,libations,n/a,n/a,n/a,n/a,n/a,n/a,n/a,n/a,n/a,n/a,n/a,n/a,n/a,no device properties in enketo,2/8/2013,a8881c0b-f1f9-4fe5-8147-4d63cbe7631e,2013-02-08T15:54:02
2/5/2013,n/a,n/a,n/a,n/a,n/a,n/a,n/a,n/a,n/a,n/a,n/a,n/a,n/a,n/a,no device properties in enketo,2/5/2013,ba595239-57ab-48c5-a326-0713f7426f21,2013-02-06T06:23:31
1/30/2013,morning_food,n/a,12,delectible,n/a,low_risk,n/a,n/a,n/a,41.9271 -87.6429 0 41,41.9271,-87.6429,0,41,no device properties in enketo,1/30/2013,57568b33-9d9a-4f81-889a-3aea1012ef6b,2013-01-26T21:12:40
1/26/2013,morning_food,n/a,2,delectible,n/a,low_risk,n/a,n/a,n/a,n/a,n/a,n/a,n/a,n/a,no device properties in enketo,1/26/2013,0554aad1-c58b-4ccf-8b05-27e58e49c223,2013-01-26T21:07:13
1/30/2013,dinner,n/a,n/a,n/a,n/a,n/a,n/a,n/a,n/a,14.1775 121.3213 0 0,14.1775,121.3213,0,0,no device properties in enketo,1/30/2013,0eca4e72-e810-448f-9287-4fd8a734f68b,2013-01-30T22:28:05
1/31/2013,dinner,Fji,n/a,delectible,n/a,medium_risk,n/a,n/a,n/a,54.8557991 58.4184033 0.0 2068.0,54.8557991,58.4184033,0,2068,8.66064E+14,1/31/2013,3d80d4f7efa54bcc9c57d0e24e9992f6,2013-01-31T05:46:21
2/27/2013,deserts,Eiterschnitte,12.5,bad,würg,high_risk,n/a,dfhhhtff,hvfghgfg,n/a,n/a,n/a,n/a,n/a,no device properties in enketo,2/27/2013,7fdfcab2-8828-4254-9a5b-bb5b013e8ce0,2013-02-28T05:52:13
4/12/2013,not_sure,Algae ?,45,bad,Greenish,high_risk,n/a,GrbgBn,n/a,43.6003 1.4442 0 0,43.6003,1.4442,0,0,no device properties in enketo,4/12/2013,42de6153-3a5c-4dfb-b057-3c0326ee7419,2013-04-12T16:25:38
4/12/2013,deserts,Ô3C,19,delectible,Croustade,low_risk,n/a,Peyrolière,n/a,43.6006133 1.4413146 0.0 23.079,43.6006133,1.4413146,0,23.079,3.5835E+14,4/12/2013,acdf4bc151c3438e974930f0c96d1281,2013-04-12T16:22:02
1/24/2013,caffeination,Pizza,450,epic_eat,Bueno,medium_risk,1359084374967.jpg,Maturin,1359084406400.jpg,9.7098974 -63.1531281 0.0 3301.0,9.7098974,-63.1531281,0,3301,3.55143E+14,1/24/2013,65fccbeac09944d1a98caa7eec9a2d18,2013-01-24T22:27:45
3/20/2013,lunch,Eggplant,150,delectible,n/a,low_risk,n/a,n/a,n/a,n/a,n/a,n/a,n/a,n/a,3.544E+14,3/20/2013,8feb067a838a4d7f98318ecac0eb8087,2013-03-20T11:24:00
3/19/2013,lunch,Ikan Laut Segar,15000,epic_eat,Nice ,low_risk,n/a,Cristo Rei,n/a,-8.5385052 125.6139716 0.0 36.0,-8.5385052,125.6139716,0,36,a1000028adb254,3/19/2013,cb059d1fee28458a97b585b4e7242f3c,2013-03-19T03:56:00
3/19/2013,morning_food,Bubur Ayam,8000,epic_eat,Enuaakk,low_risk,n/a,Warung Kopi,n/a,n/a,n/a,n/a,n/a,n/a,a1000028adb254,3/19/2013,af1eb2d969f4451eadbf5388353ab8c0,2013-03-19T03:15:02
4/20/2013,libations,hi,20,bad,good,medium_risk,n/a,n/a,n/a,40.7297 -73.9935 0 39.8,40.7297,-73.9935,0,39.8,no device properties in enketo,4/20/2013,ed78c878-b756-42c6-a933-c5eff6b32e0c,2013-04-20T22:56:56
3/15/2013,morning_food,Bethesda Bagels,1.5,delectible,n/a,low_risk,n/a,Dupont,n/a,38.9243732 -77.0434711 0.0 47.0,38.9243732,-77.0434711,0,47,3.59605E+14,3/15/2013,11dde7d3a0864171b99c8425842a5abf,2013-03-15T07:39:27
3/23/2013,lunch,Tika,450,delectible,Filling,low_risk,1364029557507.jpg,Parklands,n/a,-1.2745587 36.8269839 0.0 27.0,-1.2745587,36.8269839,0,27,3.51746E+14,3/23/2013,33d6f8b2304d4dde8d570fcd064a0d07,2013-03-23T05:06:50
4/10/2013,morning_food,good,0,nothing_special,none,low_risk,none,trial,restaurat,47.3686 8.5392 0.1 0,47.3686,8.5392,0.1,0,no device properties in enketo,4/10/2013,0aa925ed-fe71-4494-96a4-fdbb264db5b5,2013-04-10T06:09:03
4/10/2013,street_meat,Asdfrio lkjdo,6523,nothing_special,gfrtuhhh bhhh,medium_risk,1365640340440.jpg,dersfg,n/a,7.115910001818679 -73.11778647005579 1004.0 32.0,7.115910002,-73.11778647,1004,32,3.53337E+14,4/10/2013,a7074c071d2a4b86908de4fe406be711,2013-04-18T06:29:02
6/12/2013,dinner,Snack,60,nothing_special,Flavoured,low_risk,1371023557847.jpg,Three d,n/a,-1.2998815 36.7773284 0.0 1593.0,-1.2998815,36.7773284,0,1593,3.59104E+14,6/12/2013,479973913d3b4c79a294c26ca06423d4,2013-06-12T05:07:40
3/25/2013,street_meat,Hot dog,1,nothing_special,so so,medium_risk,n/a,n/a,n/a,n/a,n/a,n/a,n/a,n/a,no device properties in enketo,3/25/2013,b3a02fcc-7882-42eb-95b0-cf348c139800,2013-03-25T02:51:47
3/30/2013,morning_food,Tea ,100,bad,Their djjwjd ,high_risk,1364635127419.jpg,Fd,n/a,24.8580158 67.0613027 0.0 687.0,24.8580158,67.0613027,0,687,3.54895E+14,3/30/2013,73212ff486e140939c11f1161a857e68,2013-04-08T04:36:35
n/a,morning_food,иир,7,epic_eat,р,low_risk,n/a,n/a,n/a,n/a,n/a,n/a,n/a,n/a,n/a,n/a,dc08c06e-8350-4e0a-a2b1-ab9421065b28,2013-05-10T08:16:53
n/a,morning_food,иии,6,epic_eat,то,low_risk,n/a,ррр,n/a,n/a,n/a,n/a,n/a,n/a,3.5289E+14,n/a,696082e9cd91411eb6d34d4cdddaadef,2013-05-10T08:10:24
5/9/2013,morning_food,Е,n/a,nothing_special,Прр,low_risk,n/a,П,n/a,n/a,n/a,n/a,n/a,n/a,3.5289E+14,5/9/2013,5be9b73c69d0421b820a68ea88e07511,2013-05-10T07:29:58
5/10/2013,lunch,Keiths supper,12,bad,Dude food,high_risk,1368179760380.jpg,Keiths Kitchen,n/a,n/a,n/a,n/a,n/a,n/a,2.51826E+14,5/10/2013,c465eaa337b743f2ab56e492945af540,2013-05-10T05:57:33
5/10/2013,morning_food,fpp,6,n/a,n/a,n/a,n/a,n/a,n/a,n/a,n/a,n/a,n/a,n/a,no device properties in enketo,5/10/2013,08ae324c-c7cf-497f-bba8-59cd88a4a178,2013-05-10T02:46:46
6/12/2013,morning_food,Ugali and sukuma,50.5,nothing_special,Good ,medium_risk,1371022772470.jpg,Fd,1371022829601.jpg,-1.2982991 36.779125 0.0 40.0,-1.2982991,36.779125,0,40,3.59104E+14,6/12/2013,67bae1410f5441bf88c73f9ad5592779,2013-06-12T04:02:02
6/12/2013,n/a,Cake,25.5,n/a,Poorly made,n/a,1371022743891.jpg,Kwale,n/a,-1.2998815 36.7773284 0.0 1593.0,-1.2998815,36.7773284,0,1593,3.59104E+14,6/12/2013,fce9b3d16388451dbd6c9e235109f639,2013-06-12T05:07:25
5/9/2013,n/a,Ен,n/a,delectible,П,medium_risk,n/a,Рро,n/a,n/a,n/a,n/a,n/a,n/a,3.5289E+14,5/9/2013,718c5234440641f1a6ac49315f2dfebf,2013-05-09T10:25:22
5/19/2013,morning_food,n/a,10,epic_eat,n/a,low_risk,granola,New Haven,Claire's,41.3072 -72.9288 0 0,41.3072,-72.9288,0,0,no device properties in enketo,5/19/2013,38c57316-e6c9-4136-809d-71e15b83e11d,2013-05-19T12:58:04
5/19/2013,libations,Goodbar,n/a,delectible,n/a,medium_risk,n/a,n/a,n/a,32.8066 -117.2472 45.2 10,32.8066,-117.2472,45.2,10,no device properties in enketo,5/19/2013,37837cd3-5b6f-4827-a301-29bfbf8b0148,2013-05-19T12:16:33
6/12/2013,n/a,Pilau,120,n/a,Super spicy,n/a,1371023585751.jpg,Ukunda,n/a,-1.2984118709484362 36.77925480583758 1710.0 50.0,-1.298411871,36.77925481,1710,50,3.59104E+14,6/12/2013,e78afa559a3c41e8873885f8c1343513,2013-06-12T08:28:22
5/17/2013,caffeination,ice coffee,2.5,nothing_special,n/a,medium_risk,n/a,Starbucks Kakaako,Starbucks,21.2958 -157.8561 0 36,21.2958,-157.8561,0,36,no device properties in enketo,5/17/2013,45b7005a-d6d6-4cf5-a044-8f8eef8a6213,2013-05-17T21:54:17
6/19/2013,dinner,Heavy meal,150,nothing_special,n/a,low_risk,n/a,Nairobi,n/a,n/a,n/a,n/a,n/a,n/a,3.54795E+14,6/19/2013,cb8d9f3b20b34817a42a2b211ac848aa,2013-06-18T23:51:07
4/22/2013,caffeination,n/a,n/a,n/a,n/a,n/a,n/a,n/a,n/a,n/a,n/a,n/a,n/a,n/a,no device properties in enketo,4/22/2013,e2ea4389-b995-4b06-9ace-7448b138ad86,2013-04-22T09:44:53
5/9/2013,morning_food,n/a,n/a,nothing_special,n/a,low_risk,n/a,n/a,n/a,14.4349 -13.5349 0 0,14.4349,-13.5349,0,0,no device properties in enketo,5/9/2013,c7c72aa4-cc40-4a58-9354-135b9c145269,2013-05-09T05:45:07
n/a,morning_food,иии,7,epic_eat,енг,low_risk,n/a,мрр,n/a,n/a,n/a,n/a,n/a,n/a,n/a,n/a,42b350ef-915b-458d-b254-d4df4ce2ccd1,2013-05-10T08:44:23
4/24/2013,street_meat,Djt,85,nothing_special,G,medium_risk,n/a,Yyy,n/a,33.685674999999996 73.04389666666665 555.8 0.0,33.685675,73.04389667,555.8,0,8.6358E+14,4/24/2013,659545f56a854ccd89fd442a69e22dc8,2013-04-23T23:00:31
5/8/2013,other,Momo,50,epic_eat,Super duper yummy,medium_risk,n/a,Kathmandu,n/a,27.723051703789206 85.33101633102498 1184.9462915169904 48.0,27.7230517,85.33101633,1184.946292,48,10:bf:48:ca:38:81,5/8/2013,559287ce4bab44fd8ef5679f36d9d905,2013-05-08T08:51:30
5/3/2013,street_meat,H,5,nothing_special,Gsjd,medium_risk,n/a,Bdnd,n/a,n/a,n/a,n/a,n/a,n/a,3.54155E+14,5/3/2013,209a30b452f243098186d010a4e65c42,2013-05-03T11:36:09
5/3/2013,caffeination,H,n/a,n/a,n/a,n/a,n/a,n/a,n/a,n/a,n/a,n/a,n/a,n/a,3.54155E+14,5/3/2013,0c8f1dd3d7e345efac337e2e90c1cc19,2013-05-03T11:39:24
5/6/2013,morning_food,Ha,58,epic_eat,Gfs,medium_risk,1367853782093.jpg,Hgd,1367853795765.jpg,n/a,n/a,n/a,n/a,n/a,3.59828E+14,5/6/2013,66c4ee9749354b2b8ae74d0a5f42796a,2013-05-06T11:26:01
5/16/2013,morning_food,Uenak tenan,8000,nothing_special,Mak nyus,medium_risk,1368692128122.jpg,Angkringan,1368692148159.jpg,-2.1284627 103.3750034 0.0 27.0,-2.1284627,103.3750034,0,27,3.52891E+14,5/16/2013,a6278972b3e44f1d90cde41fa3cac310,2013-05-16T04:18:48
5/6/2013,morning_food,Hhkll,8999,epic_eat,Bnjj,medium_risk,1367854390478.jpg,Fhj,1367854409755.jpg,-6.7669045 39.2517972 0.0 1592.0,-6.7669045,39.2517972,0,1592,3.59828E+14,5/6/2013,2dc16a6f8e4f49cbade3c1bc1d214d05,2013-05-06T11:50:05
4/30/2013,lunch,humus,n/a,nothing_special,ok,low_risk,n/a,lr,n/a,34.7465 -92.2896 0 22000,34.7465,-92.2896,0,22000,no device properties in enketo,4/30/2013,a2bd9546-8243-4a93-b3e7-d28de90723f7,2013-04-30T14:27:24
5/6/2013,dinner,"Laksa king 
",20,epic_eat,Awesome Laksa ,low_risk,1367816727497.jpg,Flemington ,n/a,-37.8349932 144.8535755 0.0 23.0,-37.8349932,144.8535755,0,23,3.53203E+14,5/6/2013,36f588eecd5b4764be30f153b8c859ec,2013-05-06T01:06:41
6/12/2013,deserts,Chocolate fudge cake,250,epic_eat,It was very scrumptious and decadent,low_risk,1371023568464.jpg,Java house,n/a,-1.2982427 36.7791351 0.0 39.0,-1.2982427,36.7791351,0,39,3.59104E+14,6/12/2013,61a9f71377874fd99921d473df3ac17d,2013-06-12T05:19:51
6/12/2013,dinner,"Ugali, nyama choma' managu",200.5,bad,It was horrible,medium_risk,1371022743251.jpg,Burma,n/a,-1.2982125 36.7791399 0.0 37.0,-1.2982125,36.7791399,0,37,3.59104E+14,6/12/2013,fc0f4b2824cb4a50a66e61b8ccc716aa,2013-06-12T05:18:25
6/12/2013,lunch,Ugali and fish and vegetables,250,delectible,Highly nutritious,low_risk,1371023601089.jpg,Ngombeni,1371023717911.jpg,-1.2982308 36.7791314 0.0 45.0,-1.2982308,36.7791314,0,45,3.59104E+14,6/12/2013,34cbbb99d0784a16b6fcdb21fda407f0,2013-06-12T05:17:14
6/12/2013,morning_food,"2 fried eggs,1 cup tea with milk",300,epic_eat,Was nice,high_risk,1371023614191.jpg,Adams,n/a,-1.2983460733711802 36.779623355652305 1780.0 250.0,-1.298346073,36.77962336,1780,250,3.59104E+14,6/12/2013,55f11359d1d74a30ae363cacce5adf3b,2013-06-12T05:16:11
6/12/2013,morning_food,"2 fried eggs,1 cup tea with milk",300,epic_eat,Was nice,high_risk,1371023614191.jpg,Adams,n/a,-1.2983460733711802 36.779623355652305 1780.0 250.0,-1.298346073,36.77962336,1780,250,3.59104E+14,6/12/2013,c371a262669d426db9a2fbb54335d1e4,2013-06-12T05:16:11
6/12/2013,lunch,"Githeri,kales,glass orange juice,a glass of milk",230.98,nothing_special,Was delicious. Thank you.,low_risk,1371022757843.jpg,Three Dee,n/a,-1.298398008126546 36.779376518415894 1669.0 15.0,-1.298398008,36.77937652,1669,15,3.59104E+14,6/12/2013,101d5b2482914af5bb4d34350883bda2,2013-06-12T05:14:16
6/12/2013,lunch,Rice green salad,300.5,nothing_special,Nothing special,medium_risk,1371022752515.jpg,Nairobi,1371022832575.jpg,-1.298430716774142 36.77933921206593 1709.0 20.0,-1.298430717,36.77933921,1709,20,3.59104E+14,6/12/2013,e838dfc395ec4dd5878280b2926d2e10,2013-06-12T05:07:47
6/12/2013,dinner,Steak & Mushroom,800,delectible,Good steak,low_risk,n/a,Crown,n/a,-1.2998815 36.7773284 0.0 1593.0,-1.2998815,36.7773284,0,1593,3.59104E+14,6/12/2013,035644a7d19f4e7d820f14c25298934c,2013-06-12T05:07:44
6/12/2013,lunch,Tloi due fior,100.5,nothing_special,Stomach,medium_risk,1371022739650.jpg,Habesha,n/a,-1.2982620540466958 36.77948399224483 1789.0 20.0,-1.298262054,36.77948399,1789,20,3.59104E+14,6/12/2013,6927a82487b1427ea3187273f2d9b7cd,2013-06-12T05:07:42
6/12/2013,morning_food,Breakfast,250,epic_eat,Delicious,low_risk,1371022748232.jpg,Moi Avenue,n/a,-1.298388914624895 36.77928440647831 1788.0 20.0,-1.298388915,36.77928441,1788,20,3.59104E+14,6/12/2013,ddddd9681fd5487bbcd97a271d6553b8,2013-06-12T05:07:30
6/12/2013,morning_food,Uji,100.5,nothing_special,Of poor quality,high_risk,1371022788367.jpg,Hki training,n/a,-1.297081621947084 36.78480489718198 621.0 100.0,-1.297081622,36.7848049,621,100,3.59104E+14,6/12/2013,79851f22c5e74c68a07d6232c49fa0b5,2013-06-12T05:07:19
6/2/2013,deserts,Sanlucar,n/a,n/a,n/a,n/a,n/a,n/a,n/a,n/a,n/a,n/a,n/a,n/a,no device properties in enketo,6/2/2013,0b9a643a-fbba-4f1e-96db-b826d4fa1a1f,2013-06-03T14:08:31
6/3/2013,lunch,z,12,nothing_special,n/a,low_risk,n/a,n/a,n/a,n/a,n/a,n/a,n/a,n/a,no device properties in enketo,6/3/2013,20caba01-b800-4aed-be7a-b6e35cd1ec98,2013-06-03T13:52:17
6/2/2013,n/a,n/a,n/a,n/a,n/a,n/a,n/a,n/a,n/a,n/a,n/a,n/a,n/a,n/a,no device properties in enketo,6/2/2013,0db85249-7cae-4ba2-a930-6c122eea3154,2013-06-03T14:08:02
7/12/2013,morning_food,n/a,4,delectible,test,low_risk,1,2,3,9.0065 38.7378 0 0,9.0065,38.7378,0,0,no device properties in enketo,7/12/2013,4d0c9229-1f49-4063-a482-c822b66187f4,2013-07-12T11:04:37
6/12/2013,morning_food,Hfdfggf,50,epic_eat,Nice,low_risk,1371018006656.jpg,Faizabad,n/a,33.664464354515076 73.08401048183441 522.0 48.0,33.66446435,73.08401048,522,48,3.54957E+14,6/12/2013,64188daffa2c45839b336d2aa9340b8e,2013-06-12T02:27:01
6/5/2013,morning_food,Xfhhgijj,56,epic_eat,n/a,n/a,n/a,n/a,n/a,n/a,n/a,n/a,n/a,n/a,3.5626E+14,6/5/2013,a5b19807a3c54be5afd0e0e8d6137e4e,2013-06-05T03:05:45
6/5/2013,morning_food,n/a,2,epic_eat,n/a,high_risk,n/a,n/a,n/a,49.0477 -122.3601 0.1 63,49.0477,-122.3601,0.1,63,no device properties in enketo,6/5/2013,26dcb25e-37c5-4fd2-88be-54381608d65c,2013-06-05T16:50:15
7/7/2013,morning_food,dal  rice  roti,0,delectible,i am happpy to eat my home food,n/a,nice  food,navrangpura,home,23.0456 72.5497 0 20,23.0456,72.5497,0,20,no device properties in enketo,7/7/2013,aea9cc07-4377-4013-a2ca-42e9f81b4874,2013-07-07T03:50:04
5/21/2013,morning_food,Hi,20,nothing_special,Hi,low_risk,n/a,n/a,n/a,n/a,n/a,n/a,n/a,n/a,3.5815E+14,5/21/2013,4656079e0a7940b1b490d80014aedc31,2013-05-21T04:55:22
5/23/2013,dinner,pasta,10,epic_eat,good,low_risk,n/a,n/a,n/a,-1.4369 36.936 0 0,-1.4369,36.936,0,0,no device properties in enketo,5/23/2013,0bb0ebb6-d5db-4da8-ace3-48488f050e2e,2013-05-23T03:07:32
6/5/2013,morning_food,banana and cereals,500,nothing_special,nice for digestion,low_risk,1370418971420.jpg,kigali,1370419017797.jpg,n/a,n/a,n/a,n/a,n/a,3.52618E+14,6/5/2013,d559e338cfec441c9c694f6fb30fab0b,2013-06-05T04:00:31
5/29/2013,lunch,"pork, fire eggs",1,nothing_special,n/a,medium_risk,n/a,n/a,n/a,21.0314 105.7615 0 0,21.0314,105.7615,0,0,no device properties in enketo,5/29/2013,9ac9b28e-cfd3-45a8-b5da-ca61bcbd8c64,2013-05-28T23:41:46
6/5/2013,morning_food,Xggfh,45,nothing_special,Sbjngj,low_risk,1370408010764.jpg,Pmo,n/a,34.5199046 69.1753817 0.0 58.0,34.5199046,69.1753817,0,58,3.5626E+14,6/5/2013,304149ccac6e4c75979edd9fc76be4bf,2013-06-05T01:01:29
5/29/2013,morning_food,n/a,n/a,delectible,n/a,n/a,n/a,n/a,n/a,n/a,n/a,n/a,n/a,n/a,no device properties in enketo,5/29/2013,2cb5bed2-1247-4f29-91d0-3c1356efaf9d,2013-05-29T03:25:46
6/4/2013,caffeination,Lindsey,100,epic_eat,None,medium_risk,n/a,Doha,n/a,n/a,n/a,n/a,n/a,n/a,e1332d1a65998832,6/4/2013,c9b973ddc9fa44b3aa83c41f838586ff,2013-06-04T05:25:31
6/5/2013,morning_food,Hfhcfd,12,n/a,n/a,n/a,n/a,n/a,n/a,n/a,n/a,n/a,n/a,n/a,3.5626E+14,6/5/2013,6b058aff0d394c59ab73c4ef95fc4ecd,2013-06-05T01:53:23
5/31/2013,morning_food,n/a,2,nothing_special,n/a,n/a,n/a,n/a,n/a,n/a,n/a,n/a,n/a,n/a,no device properties in enketo,5/31/2013,4410f26a-bca0-48e1-a264-2c81d31e5c7d,2013-05-31T00:02:14
5/31/2013,morning_food,n/a,n/a,delectible,n/a,low_risk,n/a,dar,Posta city centre,n/a,n/a,n/a,n/a,n/a,no device properties in enketo,5/31/2013,5668eba3-53ce-4f23-b531-276e69436acf,2013-05-31T06:32:04
6/5/2013,n/a,n/a,n/a,n/a,n/a,n/a,n/a,E,n/a,n/a,n/a,n/a,n/a,n/a,3.5626E+14,6/5/2013,2b57316c65d745ad9466b963d51cdf26,2013-06-05T01:52:45
5/31/2013,morning_food,test,12,epic_eat,huhuhu,low_risk,1370010870504.jpg,rahsia,1370010890823.jpg,2.9654833 101.7584398 0.0 20.0,2.9654833,101.7584398,0,20,3.51565E+14,5/31/2013,d167a83cc344457a932e9c78873cbb88,2013-05-31T10:35:10
6/5/2013,morning_food,Green tea,500,nothing_special,No delishes,low_risk,1370408261684.jpg,MCIT,n/a,n/a,n/a,n/a,n/a,n/a,3.5626E+14,6/5/2013,c9e13a6e9cff4410b44b08e965498fbe,2013-06-05T01:01:27
6/2/2013,morning_food,Ty,12,epic_eat,Gh,low_risk,n/a,n/a,n/a,n/a,n/a,n/a,n/a,n/a,08:60:6e:a1:34:3d,6/2/2013,3068c96abd454a64bf541c3cea452b9e,2013-06-02T15:18:27
6/2/2013,morning_food,Olivares,n/a,n/a,n/a,n/a,n/a,n/a,n/a,n/a,n/a,n/a,n/a,n/a,no device properties in enketo,6/2/2013,fd77a360-44b7-4733-9d95-c8b35d82b2c6,2013-06-03T14:08:13
6/5/2013,morning_food,Bread n Butter,500,nothing_special,General Breakfast,low_risk,1370408475049.jpg,Kbl,n/a,n/a,n/a,n/a,n/a,n/a,3.5626E+14,6/5/2013,c7b2a8ba65354d1c9c76243311e95898,2013-06-05T01:09:39
8/8/2013,morning_food,Ugali,1,epic_eat,this eat was spectacular!,low_risk,n/a,nairobi,nairobi,0.0004 -0.0004 0.2 0.2,0.0004,-0.0004,0.2,0.2,no device properties in enketo,8/8/2013,06846562-1e62-4b21-9713-273e36cb7999,2013-08-08T07:49:54
6/19/2013,morning_food,Good food,234,delectible,Very good food,low_risk,1371623700502.jpg,Delhi,1371623722751.jpg,28.4579914 77.0717028 0.0 895.0,28.4579914,77.0717028,0,895,3.56262E+14,6/19/2013,eb82ac502b7942a6bbb3cb15a80f7ef2,2013-06-19T02:36:28
7/9/2013,morning_food,n/a,5,epic_eat,n/a,low_risk,n/a,n/a,n/a,-7.711 41.4844 0 0,-7.711,41.4844,0,0,no device properties in enketo,7/9/2013,d7865b6d-dd13-4ead-80a5-4166ce089f29,2013-07-09T08:47:50
7/1/2013,morning_food,very well done,n/a,epic_eat,n/a,n/a,n/a,n/a,n/a,n/a,n/a,n/a,n/a,n/a,no device properties in enketo,7/1/2013,8578631b-9a18-4b2e-be16-7026eb179b49,2013-07-01T11:00:57
7/5/2013,morning_food,n/a,n/a,epic_eat,n/a,low_risk,n/a,n/a,n/a,-13.8669 -40.0713 0 0,-13.8669,-40.0713,0,0,no device properties in enketo,7/5/2013,910104b3-e0fb-460b-80b3-ae3744e58bb7,2013-07-05T13:49:00
8/16/2013,morning_food,n/a,n/a,n/a,n/a,n/a,n/a,n/a,n/a,n/a,n/a,n/a,n/a,n/a,no device properties in enketo,8/16/2013,248658b6-ded2-4c2c-9b65-add5b30f312e,2013-08-16T10:01:37
9/10/2013,lunch,rice and chicken,2000,bad,good,low_risk,n/a,Nairobi,88mph,-1.2993 36.7653 0 30,-1.2993,36.7653,0,30,no device properties in enketo,9/10/2013,64091b14-4f7b-4982-805a-2361a1323723,2013-09-10T10:11:55
7/5/2013,lunch,falafel,100,epic_eat,n/a,high_risk,n/a,n/a,n/a,19.0621 -2.5488 0 0,19.0621,-2.5488,0,0,no device properties in enketo,7/5/2013,ea5ef4aa-40bd-4582-bb41-29d721fa9c13,2013-07-05T10:49:59
7/1/2013,morning_food,ffdfd,2,epic_eat,fdfd,low_risk,f,fds,fdfs,14.6088 -90.5054 0 0,14.6088,-90.5054,0,0,no device properties in enketo,7/1/2013,3702441f-d746-4a61-9080-b9f8f95fa4d3,2013-07-01T12:01:54
7/29/2013,street_meat,Noodle with fried pork,1200,epic_eat,Quit good,medium_risk,1375078712094.jpg,Gsm 123,n/a,17.9660232 102.6016087 0.0 32.0,17.9660232,102.6016087,0,32,3.57116E+14,7/29/2013,4da8ae3a95d04691b66f55bf058a27c6,2013-07-29T10:28:01
8/21/2013,street_meat,Spicy,20,bad,OK,high_risk,n/a,Sydney,street,-33.87 151.2073 0 0,-33.87,151.2073,0,0,no device properties in enketo,8/21/2013,0de025a6-beed-4da7-8243-2447b2922b89,2013-08-21T14:32:35
8/1/2013,dinner,Medallones de res,300,epic_eat,Riquisimo,low_risk,n/a,Ticuantepe,n/a,n/a,n/a,n/a,n/a,n/a,no device properties in enketo,8/1/2013,543318a2-b7f6-4724-a03c-98ff8cb51e6d,2013-08-02T04:45:15
8/1/2013,morning_food,Huevo revuelto,100,nothing_special,n/a,low_risk,n/a,n/a,n/a,n/a,n/a,n/a,n/a,n/a,no device properties in enketo,8/1/2013,51018eda-d845-4550-b564-1e22568671d4,2013-08-02T04:45:18
8/1/2013,morning_food,Frijoles,50,delectible,n/a,n/a,n/a,n/a,n/a,n/a,n/a,n/a,n/a,n/a,no device properties in enketo,8/1/2013,82dba071-9235-4f8c-b58c-d5bfebebb729,2013-08-02T04:48:20
7/19/2013,street_meat,n/a,2,nothing_special,n/a,high_risk,n/a,n/a,n/a,12.6266 -7.9861 0 18,12.6266,-7.9861,0,18,no device properties in enketo,7/19/2013,64303a64-5ed2-49e4-9291-beadc8697692,2013-07-19T09:51:12
7/19/2013,dinner,n/a,n/a,epic_eat,n/a,low_risk,n/a,n/a,n/a,n/a,n/a,n/a,n/a,n/a,no device properties in enketo,7/19/2013,e1a8b035-2dee-4112-9911-e804fdb6da47,2013-07-19T08:37:13
7/19/2013,dinner,Spaghetti and kale,1,nothing_special,Home cooked goodness.,low_risk,n/a,"Nairobi, Kenya",Home,-1.2921 36.8219 1300 200,-1.2921,36.8219,1300,200,no device properties in enketo,7/19/2013,ebdff3ae-8817-4df1-a3b8-da1e66ebd6a1,2013-07-19T16:29:25
7/19/2013,other,Milk,60,nothing_special,Got milk? Cheque please! ,low_risk,n/a,n/a,n/a,n/a,n/a,n/a,n/a,n/a,3.55093E+14,7/19/2013,769dfd9be57d4e8fbe5773d3daeef4e6,2013-07-19T20:32:23
9/10/2013,dinner,Din dins,20,delectible,Good stuff.,high_risk,n/a,Home,n/a,n/a,n/a,n/a,n/a,n/a,3.59759E+14,9/10/2013,0e10714bd7f94d3e89f4b811889148a6,2013-09-11T01:10:43
7/21/2013,morning_food,Buttered toast.,40,bad,I never knew this was possible! Thanks Ed.,medium_risk,1374375973120.jpg,NBO,1374375995761.jpg,n/a,n/a,n/a,n/a,n/a,3.55093E+14,7/21/2013,5973ee5ec53545f09123dcef35372306,2013-07-21T03:07:25
9/10/2013,dinner,Din dins,20,delectible,Good stuff.,high_risk,n/a,Home,n/a,n/a,n/a,n/a,n/a,n/a,3.59759E+14,9/10/2013,130b1e185e61422881bdbb4fa35d17c3,2013-09-11T01:12:17
8/1/2013,morning_food,Gallo pinto con cuajada,1,delectible,Comida tipica de Nicaragua,low_risk,n/a,Nindirí,n/a,12.0345 -86.1555 0 0,12.0345,-86.1555,0,0,no device properties in enketo,8/1/2013,3465c444-ad81-47f6-ad10-0fbfcd7fbb1c,2013-08-01T21:36:47
7/23/2013,morning_food,Nasi goreng,8000,epic_eat,Ok,low_risk,1374551811028.jpg,Jakarta,n/a,n/a,n/a,n/a,n/a,n/a,8.688E+14,7/23/2013,8813f37999dc490ba083b33034209644,2013-07-23T03:58:19
7/29/2013,lunch,Rice with chicken breast,15000,nothing_special,To few Vegetable ,low_risk,n/a,Noodle box,n/a,17.9660285 102.6016181 0.0 32.0,17.9660285,102.6016181,0,32,3.57116E+14,7/29/2013,be2a71b9f6b0411593317545bb78091f,2013-07-29T10:27:25
7/24/2013,morning_food,n/a,n/a,n/a,n/a,n/a,n/a,india,mumbai,58.6998 -90.3516 0 0,58.6998,-90.3516,0,0,no device properties in enketo,7/24/2013,0753ae16-56ac-4aab-85f0-89d46b1c2aa3,2013-07-24T05:34:56
6/7/2013,morning_food,Coffee,1.8,bad,Ritazza at who,low_risk,1370590821306.jpg,Da office ,n/a,n/a,n/a,n/a,n/a,n/a,9.11241E+14,6/7/2013,7819aa150fc9471f83a27855daf2f9f4,2013-07-24T06:43:59
9/13/2013,baked_goods,n/a,n/a,n/a,n/a,n/a,n/a,n/a,n/a,n/a,n/a,n/a,n/a,n/a,3.59759E+14,9/13/2013,7668142ba95f4e10afd88b7b96fdd61e,2013-09-13T08:13:20
10/10/2013,morning_food,Test,67666,epic_eat,This is Great!,medium_risk,Test,Kampala,Serena,0.3136 32.5811 0 0,0.3136,32.5811,0,0,no device properties in enketo,10/10/2013,ef66c7ea-9406-444e-aa58-47fe40560b78,2013-10-10T08:56:58
9/17/2013,morning_food,Love Crunch,4.65,delectible,n/a,low_risk,n/a,n/a,n/a,n/a,n/a,n/a,n/a,n/a,no device properties in enketo,9/17/2013,ef9ae637-5dae-43c6-afee-8a3b41806aed,2013-09-18T00:51:07
9/13/2013,n/a,n/a,n/a,n/a,n/a,n/a,n/a,n/a,n/a,n/a,n/a,n/a,n/a,n/a,3.59759E+14,9/13/2013,492120c38ef046d5895cf21e5daa39a3,2013-09-13T07:19:03
10/11/2013,morning_food,Musli,10,nothing_special,n/a,low_risk,n/a,n/a,n/a,n/a,n/a,n/a,n/a,n/a,8.60085E+14,10/11/2013,2ceef3e40cef450a854d08ffa85718f4,2013-10-10T22:24:15
11/8/2013,savory_snacks,Meat balls with salad,3000,bad,Nzagaruka,high_risk,n/a,Camillia tea house,n/a,n/a,n/a,n/a,n/a,n/a,3.56096E+14,11/8/2013,c8b1424c831745d5bf68d067efe34169,2013-11-08T18:45:26
10/29/2013,morning_food,hjjhj,66,n/a,n/a,n/a,n/a,n/a,n/a,n/a,n/a,n/a,n/a,n/a,no device properties in enketo,10/29/2013,8d2e926f-d9aa-4f54-8ff2-fdda3110027c,2013-10-29T09:16:25
9/6/2013,dinner,Asparagus Fries,n/a,epic_eat,n/a,low_risk,n/a,Laguna Beach,Nick's,n/a,n/a,n/a,n/a,n/a,no device properties in enketo,9/6/2013,c3409db4-de55-444f-a77a-0d7c1f8f7ac5,2013-09-06T20:13:29
8/27/2013,morning_food,fewdfw,2,epic_eat,n/a,n/a,n/a,n/a,n/a,n/a,n/a,n/a,n/a,n/a,no device properties in enketo,8/27/2013,1e8e558d-bb52-4e2e-8b74-fca6ed7f1577,2013-08-27T12:33:06
9/5/2013,drunk_food,Delicious,25,epic_eat,Amazing,medium_risk,1378418710817.jpg,Managua,1378418731978.jpg,12.1295258 -86.22496 0.0 1967.0,12.1295258,-86.22496,0,1967,3.52259E+14,9/5/2013,fca6e89426eb4533bebcab8a40405499,2013-09-05T22:10:34
8/29/2013,n/a,n/a,n/a,n/a,n/a,n/a,n/a,n/a,n/a,n/a,n/a,n/a,n/a,n/a,no device properties in enketo,8/29/2013,6bc42cce-5445-4473-8f41-1322c52d0bf8,2013-08-29T13:23:32
8/26/2013,savory_snacks,"Quesillos - A tortilla filled with melted cheese, dunked in a cup of sour cream and served in a plastic bag.",60,bad,n/a,medium_risk,n/a,n/a,n/a,12.0856 -86.2295 0 0,12.0856,-86.2295,0,0,no device properties in enketo,8/26/2013,c8182e5a-5651-44c8-99a9-80f486c73d27,2013-08-26T21:57:33
9/10/2013,morning_food,Shake,1,epic_eat,Sarap,low_risk,n/a,G,n/a,n/a,n/a,n/a,n/a,n/a,3.57453E+14,9/10/2013,2c80e96f45c64aa2a8dd4d7b29f1dcc5,2013-09-10T04:40:34
8/31/2013,dinner,Ff,12,delectible,n/a,low_risk,1377899814942.jpg,Hi,n/a,n/a,n/a,n/a,n/a,n/a,9.9E+13,8/31/2013,b7a312fb370f45beafaec2aba4ad734f,2013-08-30T21:58:06
8/28/2013,morning_food,Jjjjj,2366,epic_eat,Rr,low_risk,n/a,Sss,n/a,n/a,n/a,n/a,n/a,n/a,1.61764E+14,8/28/2013,2e20c73fa698408ab17f3faaf385cae6,2013-08-28T14:11:59
10/12/2013,n/a,n/a,n/a,n/a,n/a,n/a,n/a,n/a,n/a,n/a,n/a,n/a,n/a,n/a,no device properties in enketo,10/12/2013,2e2199f4-c585-498d-acc7-1bc0d373563c,2013-10-12T11:47:59
11/12/2013,caffeination,Coffee,2,nothing_special,Test,medium_risk,n/a,n/a,n/a,n/a,n/a,n/a,n/a,n/a,no device properties in enketo,11/12/2013,64492b82-d7a8-40dc-8327-1c295288b334,2013-11-13T04:35:16
11/8/2013,lunch,n/a,n/a,n/a,n/a,n/a,n/a,n/a,n/a,n/a,n/a,n/a,n/a,n/a,3.56096E+14,11/8/2013,e5b945baecf34545b0c92ffde3a1501a,2013-11-08T12:04:34
9/18/2013,n/a,n/a,n/a,n/a,n/a,n/a,n/a,n/a,n/a,n/a,n/a,n/a,n/a,n/a,3.544E+14,9/18/2013,f72d3e5554a748e084f2490ae0cd1201,2013-09-18T16:52:44
9/19/2013,morning_food,dddd,324,epic_eat,n/a,medium_risk,3eee,werwe,werewr,27.0591 48.5156 0 0,27.0591,48.5156,0,0,no device properties in enketo,9/19/2013,745cbe53-f606-4fa5-9cbc-f0eb5ade1f41,2013-09-19T14:48:15
9/20/2013,morning_food,"Butter, Jam and Bread",2,nothing_special,n/a,low_risk,n/a,John Knox Center,John Knox Center,46.2303 6.1355 0 0,46.2303,6.1355,0,0,no device properties in enketo,9/20/2013,59e3ad85-7958-45aa-ab2a-41a5b9de9c2d,2013-09-20T09:40:05
10/12/2013,dinner,Larb Phet,30000,bad,n/a,low_risk,n/a,n/a,Laos,19.8563 102.4955 0 0,19.8563,102.4955,0,0,no device properties in enketo,10/12/2013,3745eab4-4375-4506-8659-c9fc8d37ffc4,2013-10-12T11:47:47
9/20/2013,n/a,n/a,n/a,n/a,n/a,low_risk,n/a,n/a,n/a,50.1109 8.6821 0 140000,50.1109,8.6821,0,140000,no device properties in enketo,9/20/2013,941fb1a6-d197-42bc-bbf0-87ead51d7588,2013-09-20T13:02:19
9/20/2013,morning_food,Granola Bar,1,epic_eat,and it's good for you,low_risk,n/a,Home,Home,33.4486 -112.0558 0 63,33.4486,-112.0558,0,63,no device properties in enketo,9/20/2013,1afe3f11-b9d3-419f-813d-90324d353b40,2013-09-20T18:14:20
9/20/2013,morning_food,Banana,0.5,delectible,"Mmm, mmm good!",low_risk,Banana,Home,Home,33.448 -112.056 329.8 2734,33.448,-112.056,329.8,2734,no device properties in enketo,9/20/2013,be1dd947-b5bc-40c2-be1f-922e7e87cb24,2013-09-20T19:41:52
2/4/1970,morning_food,Fjfd,1,epic_eat,Fzvg,high_risk,n/a,Fhd,n/a,n/a,n/a,n/a,n/a,n/a,3.53527E+14,2/4/1970,cc475e7e17114d418e33de6db2012ecb,2013-10-09T16:29:13
11/14/2013,deserts,"Ffffff
",555,nothing_special,Ffff,medium_risk,n/a,Hhh,n/a,n/a,n/a,n/a,n/a,n/a,8.67055E+14,11/14/2013,38790f55f1484a1196798ab1353688d0,2013-11-14T04:04:02
11/14/2013,morning_food,Tttttt,33,nothing_special,Yuuuu,low_risk,n/a,Rrrrr,n/a,n/a,n/a,n/a,n/a,n/a,8.67055E+14,11/14/2013,b7d853af00f044e88a1ad091969578b5,2013-11-14T04:25:32
10/5/2013,n/a,n/a,n/a,n/a,n/a,n/a,n/a,n/a,n/a,n/a,n/a,n/a,n/a,n/a,8.68523E+14,10/5/2013,7dc7243f07874bc596f812d3bde24075,2013-10-06T00:37:46
10/28/2013,dinner,hgdfgh,3,epic_eat,n/a,low_risk,dfgsgs,gdsfgsdf,n/a,n/a,n/a,n/a,n/a,n/a,no device properties in enketo,10/28/2013,f4322d94-93cf-46ac-9bed-f967467876af,2013-10-28T14:35:13
9/30/2013,not_sure,n/a,n/a,n/a,n/a,low_risk,n/a,n/a,n/a,n/a,n/a,n/a,n/a,n/a,no device properties in enketo,9/30/2013,7015b745-4f79-4d1d-ab94-8cfa1964e996,2013-09-30T23:25:02
11/12/2013,n/a,n/a,n/a,n/a,n/a,n/a,n/a,n/a,n/a,n/a,n/a,n/a,n/a,n/a,no device properties in enketo,11/12/2013,c1850b50-9ac9-4084-9897-cfbbc1ad69d1,2013-11-12T15:15:25
11/7/2013,morning_food,Here urabona ko washyiramo ibintu,5252,bad,Wapi kabisa,low_risk,1383858813410.jpg,Kicukiro,n/a,n/a,n/a,n/a,n/a,n/a,3.56096E+14,11/7/2013,52f0d759e9df4f2f9f58f5ab65366f20,2013-11-07T21:15:31
10/12/2013,libations,Yes iphone,n/a,n/a,n/a,n/a,n/a,n/a,n/a,n/a,n/a,n/a,n/a,n/a,no device properties in enketo,10/12/2013,3b65fe63-ca25-448b-8173-386d6a3f46f1,2013-10-12T16:00:27
10/14/2013,morning_food,T,6,epic_eat,H,low_risk,n/a,Y,n/a,n/a,n/a,n/a,n/a,n/a,3.52373E+14,10/14/2013,ba038b2a3bb04faca0a5d2518d2ebf2f,2013-10-14T10:35:40
10/13/2013,libations,Soma,88,delectible,Refreshing,low_risk,1381652827951.jpg,Desk,1381652875177.jpg,22.5242695 88.3438886 0.0 132.0,22.5242695,88.3438886,0,132,9.9E+13,10/13/2013,439edc15818f4c20886f8719a4a5debd,2013-10-13T08:28:41
10/14/2013,baked_goods,Idhdj,467,delectible,Udh,medium_risk,1381733222827.jpg,Gf,n/a,n/a,n/a,n/a,n/a,n/a,3.57376E+14,10/14/2013,254e02e4270649e9854f32ed8f5c43e4,2013-10-14T06:48:06
10/16/2013,deserts,Just deserts,0,delectible,Abxdwf,low_risk,n/a,A place,n/a,22.524348 88.3439138 0.0 36.0,22.524348,88.3439138,0,36,9.9E+13,10/16/2013,fe58fb4325ae41dabad8af9d234b36e7,2013-10-15T21:07:57
10/16/2013,dinner,Dal,10,delectible,Delicious,low_risk,1381870824446.jpg,Plate,1381870873309.jpg,22.5243477 88.3439135 0.0 37.5,22.5243477,88.3439135,0,37.5,9.9E+13,10/16/2013,b21fc98e72f44b278f7827f8cb8d6e79,2013-10-15T21:07:56
10/16/2013,streat_sweets,Zggssg,18484,delectible,Vdjd,low_risk,n/a,Zgsh,n/a,22.524348 88.3439138 0.0 45.0,22.524348,88.3439138,0,45,9.9E+13,10/16/2013,adf59b6ccdc24c7bb9b9bdc8db29538a,2013-10-16T05:28:59
10/17/2013,morning_food,n/a,n/a,n/a,n/a,n/a,n/a,n/a,n/a,n/a,n/a,n/a,n/a,n/a,no device properties in enketo,10/17/2013,60690fe3-59f0-4a0b-8981-c457fd69920e,2013-10-17T13:49:40
10/16/2013,lunch,n/a,3,bad,n/a,n/a,n/a,University of Milano Bicocca,home,45.5132 9.2118 0 0,45.5132,9.2118,0,0,no device properties in enketo,10/16/2013,44f92031-be72-41b9-99d2-a3ee99b5efa8,2013-10-16T14:53:13
11/12/2013,dinner,n/a,n/a,nothing_special,n/a,low_risk,n/a,n/a,n/a,37.9962 -100.6238 0 0,37.9962,-100.6238,0,0,no device properties in enketo,11/12/2013,7bbc42ab-1a25-4346-93f3-78af5f6f4e0f,2013-11-12T22:29:50
10/10/2013,n/a,Monkey Island and the best way to get the job done. ,n/a,epic_eat,Your mother.,medium_risk,1381421990572.jpg,Your mother's house.,1381422040854.jpg,n/a,n/a,n/a,n/a,n/a,18:1E:B0:69:37:AD,10/10/2013,e5804a83d6f94619bb6fffa2d6e573d3,2013-10-17T08:27:41
10/17/2013,morning_food,Crlos,1000,epic_eat,Some,low_risk,n/a,n/a,n/a,-1.2484 36.7585 1900 0,-1.2484,36.7585,1900,0,no device properties in enketo,10/17/2013,5ddde0c4-898a-4036-878f-85a963777504,2013-10-17T13:42:35
10/20/2013,dinner,Hello,5,epic_eat,Hello,low_risk,n/a,Here,n/a,55.079088 82.892568 0.0 25.0,55.079088,82.892568,0,25,3.56489E+14,10/20/2013,cdc435934cfa46afb741cc817730d8ab,2013-10-20T15:20:06
10/22/2013,deserts,Nothing,45,bad,Nothing,low_risk,1382446413984.jpg,Sadar,n/a,n/a,n/a,n/a,n/a,n/a,3.52373E+14,10/22/2013,abb0c618ef7343b39f58611c1df92bd0,2013-10-22T12:54:06
11/5/2013,not_sure,n/a,n/a,epic_eat,n/a,low_risk,n/a,n/a,n/a,-0.5548 117.168 0 0,-0.5548,117.168,0,0,no device properties in enketo,11/5/2013,a040df50-b7be-442b-ac3b-4a76ea15b73e,2013-11-05T12:30:44
11/7/2013,morning_food,Thia,100,nothing_special,Here are the comments,low_risk,n/a,Laluna ,n/a,n/a,n/a,n/a,n/a,n/a,3.56096E+14,11/7/2013,e31ae6a596494b1db3716dd2137eb8de,2013-11-07T00:00:19
10/24/2013,street_meat,Wukuxtif,35,nothing_special,"Siu,cul",low_risk,1382609792155.jpg,Sudlcou,n/a,23.7947343 90.4040386 0.0 28.0,23.7947343,90.4040386,0,28,3.52373E+14,10/24/2013,2cf2907de1a94908b4987bb237473db2,2013-10-24T10:17:09
11/6/2013,morning_food,Iuu,366,epic_eat,Bbb,low_risk,n/a,Jhh,n/a,n/a,n/a,n/a,n/a,n/a,3.55847E+14,11/6/2013,3d194802be5a4e70bd3f9e917c06909e,2013-11-06T17:21:22
11/13/2013,deserts,"
Tt
",52,nothing_special,n/a,medium_risk,1384360589387.jpg,n/a,n/a,n/a,n/a,n/a,n/a,n/a,8.68275E+14,11/13/2013,51fae95d3fba44bc9143482cb359368c,2013-11-13T16:38:20
10/28/2013,morning_food,test,22,epic_eat,test,n/a,n/a,n/a,n/a,n/a,n/a,n/a,n/a,n/a,no device properties in enketo,10/28/2013,e255c62a-27e3-4b78-86be-f555a6ad86ed,2013-10-28T09:12:08
11/6/2013,lunch,n/a,n/a,n/a,n/a,n/a,n/a,n/a,n/a,n/a,n/a,n/a,n/a,n/a,no device properties in enketo,11/6/2013,28b31aeb-850b-4260-8cae-04a87ddcf9ec,2013-11-06T10:28:58
10/28/2013,libations,"Zrgtsmut,f",348,nothing_special,Gsjfumu8,low_risk,1382951551110.jpg,Fyk,1382951558776.jpg,23.748524719848675 90.43569033047689 -26.784998605058263 8.0,23.74852472,90.43569033,-26.78499861,8,3.52373E+14,10/28/2013,7bff72a0424a4bc2ab4f4097da34dda4,2013-10-28T11:09:32
10/28/2013,drunk_food,Siusoyx,66997,bad,Utsjkyxkhc,medium_risk,1382958857028.jpg,n/a,1382958871454.jpg,23.7481045 90.4319948 0.0 1505.0,23.7481045,90.4319948,0,1505,3.52373E+14,10/28/2013,eeae2a980659423192816c5c30f3a27e,2013-10-28T11:22:59
10/28/2013,savory_snacks,Rrtyu,67,nothing_special,J,medium_risk,1382959089642.jpg,Ik,1382959097182.jpg,23.7484881 90.4356896 0.0 114.0,23.7484881,90.4356896,0,114,3.52373E+14,10/28/2013,2d71dfbe1bb146db89208e3908516150,2013-10-28T11:23:13
11/5/2013,caffeination,Décaféiné,2,bad,C cool,low_risk,1383658968367.jpg,Paris,n/a,48.8778814 2.3720993 0.0 49.105,48.8778814,2.3720993,0,49.105,3.52376E+14,11/5/2013,5f2be5c989da448096cb1aa4541cdeb5,2013-11-05T14:00:48
11/1/2013,morning_food,"Cereals
!",100,epic_eat,8,n/a,n/a,n/a,n/a,n/a,n/a,n/a,n/a,n/a,3.56649E+14,11/1/2013,c56379e0ee384e598edbcbc41ea90b92,2013-11-01T12:38:10
11/5/2013,morning_food,n/a,n/a,epic_eat,n/a,low_risk,n/a,n/a,n/a,n/a,n/a,n/a,n/a,n/a,no device properties in enketo,11/5/2013,5508be38-bb14-4e07-bb8f-ed3c6157ab50,2013-11-05T12:31:18
11/13/2013,morning_food,Pancake,2,epic_eat,Recommended to everyone I met,high_risk,n/a,Siem Reap,n/a,13.364351336758293 103.86632613833754 8.680493438655144 6.0,13.36435134,103.8663261,8.680493439,6,08:60:6e:b0:ca:a9,11/13/2013,04b0806560a440c1adf736100f364862,2013-11-13T05:26:37
11/13/2013,lunch,Sandwich,5,delectible,Good grub,medium_risk,1384320772140.jpg,Siem Reap,1384320815163.jpg,13.364464316263314 103.86641803057744 4.234638539977011 8.0,13.36446432,103.866418,4.23463854,8,08:60:6e:b0:ca:a9,11/13/2013,785e3e40ea4849eeb62af22bf4a7d554,2013-11-13T05:34:20
11/14/2013,street_meat,Rrr,222,bad,Ttt,low_risk,1384402065886.jpg,Yy,n/a,n/a,n/a,n/a,n/a,n/a,8.67055E+14,11/14/2013,594f96bfbd014e09a74758e5a23b90c2,2013-11-14T04:11:02
12/4/2013,not_sure,Chicken?,30,bad,n/a,high_risk,n/a,Ti Goave,n/a,18.42306225666435 -72.72481507689612 -26.108748121656472 6.0,18.42306226,-72.72481508,-26.10874812,6,3.544E+14,12/4/2013,c65e20d0e9604a63a41ed862333e596b,2013-12-04T22:52:37
12/4/2013,morning_food,n/a,n/a,n/a,n/a,n/a,n/a,n/a,n/a,n/a,n/a,n/a,n/a,n/a,no device properties in enketo,12/4/2013,c2572ebb-b7f9-4250-97a7-9b6740e785ee,2013-12-04T20:33:10
12/4/2013,morning_food,testing,n/a,n/a,testacular,n/a,n/a,n/a,n/a,n/a,n/a,n/a,n/a,n/a,no device properties in enketo,12/4/2013,4477324c-1fd1-4364-830b-da5957e90d69,2013-12-04T20:36:21
11/20/2013,deserts,;mlhkhiuguiiug,787,epic_eat,none,high_risk,bwah,here,not here,n/a,n/a,n/a,n/a,n/a,no device properties in enketo,11/20/2013,9cf5529d-3d10-43fc-ba0d-4d89cca45cd0,2013-11-21T01:30:52
12/4/2013,morning_food,n/a,1,bad,n/a,medium_risk,n/a,n/a,n/a,n/a,n/a,n/a,n/a,n/a,no device properties in enketo,12/4/2013,93c487f0-5080-4008-8769-7f8cdacf64dd,2013-12-04T15:56:51
11/22/2013,morning_food,Test breakfast,123.45,delectible,Comments,high_risk,1385157530269.jpg,Home,n/a,40.7706847 -73.9081786 0.0 25.0,40.7706847,-73.9081786,0,25,E4:40:E2:1F:27:7E,11/22/2013,e8f12d4234864fadbe2fccea990668cf,2013-11-22T21:59:26
11/24/2013,libations,Coffee and a scone ,5,epic_eat,n/a,low_risk,n/a,Baines,n/a,n/a,n/a,n/a,n/a,n/a,B8:5E:7B:A0:69:42,11/24/2013,e0fcb6cbe0b045f8ad8856eec68e5f21,2013-11-24T21:24:19
12/2/2013,morning_food,yogurt,1,nothing_special,just breakfast,low_risk,n/a,Atlanta,grocery store,33.749 -84.388 0 0,33.749,-84.388,0,0,no device properties in enketo,12/2/2013,ded72f83-dca1-42ce-b8ca-0caf5b5c390e,2013-12-02T13:19:29
12/1/2013,street_meat,Merci exercice ,4,nothing_special,Efcrfc,medium_risk,n/a,Efcrfc ,n/a,n/a,n/a,n/a,n/a,n/a,D8:90:E8:A3:44:2B,12/1/2013,74bedcb539884932a1c17a4659efe6be,2013-11-30T23:19:39
12/8/2013,lunch,1 pm to 2 pm,100,nothing_special,as,medium_risk,FFC,Gulshan -2,Road-2,n/a,n/a,n/a,n/a,n/a,no device properties in enketo,12/8/2013,072b9c25-4738-4546-8a56-e647fcb3fc76,2013-12-08T02:13:13
